{
  "schema_version": 2,
  "project_id": "mmseqs2",
  "source_commit": "771ee2387007d040819436e26062ff69f320144e",
  "review_type": "manifest_curation",
  "reviewer_id": "codex:curator",
  "review_round": 1,
  "sampling_seed": 0,
  "sample": [
    {
      "file": "README.md",
      "start_line": 1,
      "end_line": 120,
      "item_type": "interface_and_source_scope",
      "item_name": "mmseqs2"
    }
  ],
  "assessment": {
    "manifest_sha256": "69f23f47bff4fc2875e02dd15ddc77c20c9bb414326428e8b587054f98c4a985",
    "source_roots_reviewed": true,
    "commands_are_argument_arrays": true,
    "fixtures_and_applicability_reviewed": true,
    "upstream_tests_not_requested": true
  },
  "confidence": "high",
  "evidence_notes": "Initial metadata and upstream-documentation curation of interface, fixtures, and source scope.",
  "adjudication_required": false
}
