{
  "schema_version": 2,
  "project_id": "peptide-shaker",
  "source_commit": "c052d101e303d0ce2c8621429ccd6e677467d4d7",
  "review_type": "manifest_curation",
  "reviewer_id": "codex:curator",
  "review_round": 1,
  "sampling_seed": 0,
  "sample": [
    {
      "file": "README.md",
      "start_line": 96,
      "end_line": 142,
      "item_type": "interface_and_source_scope",
      "item_name": "peptide-shaker"
    }
  ],
  "assessment": {
    "manifest_sha256": "35707b2ffbd55584ad15f96fc9ad27024b50b4a3282de8e7e08128497ff5d324",
    "source_roots_reviewed": true,
    "commands_are_argument_arrays": true,
    "fixtures_and_applicability_reviewed": true,
    "upstream_tests_not_requested": true
  },
  "confidence": "high",
  "evidence_notes": "Initial metadata and upstream-documentation curation of interface, fixtures, and source scope.",
  "adjudication_required": false
}
