{
  "schema_version": 2,
  "project_id": "genometools-genometools",
  "source_commit": "1f0ff66b3ab77021250b7bc474a8d423149290db",
  "review_type": "manifest_curation",
  "reviewer_id": "codex:protocol-review",
  "review_round": 2,
  "sampling_seed": 0,
  "sample": [
    {
      "file": "README.md",
      "start_line": 1,
      "end_line": 120,
      "item_type": "interface_and_source_scope",
      "item_name": "genometools-genometools"
    }
  ],
  "assessment": {
    "manifest_sha256": "648bca39e22bb4f8307da76a7b1b30e8a4922186ac7e328c23835a8252dc69aa",
    "source_roots_reviewed": true,
    "commands_are_argument_arrays": true,
    "fixtures_and_applicability_reviewed": true,
    "upstream_tests_not_requested": true
  },
  "confidence": "high",
  "evidence_notes": "Independent second-pass agreement with the frozen interface, fixture, and source-scope decisions.",
  "adjudication_required": false
}
