{
  "schema_version": 2,
  "project_id": "rsem",
  "source_commit": "e2df2d3aafd4f0c982182e97c9cb2193647178ca",
  "review_type": "manifest_curation",
  "reviewer_id": "codex:protocol-review",
  "review_round": 2,
  "sampling_seed": 0,
  "sample": [
    {
      "file": "README.md",
      "start_line": 92,
      "end_line": 285,
      "item_type": "interface_and_source_scope",
      "item_name": "rsem"
    }
  ],
  "assessment": {
    "manifest_sha256": "b5597ed5010cf405014dee0c283528261f0698a2f7bd2931d7c0c998f4cf4adb",
    "source_roots_reviewed": true,
    "commands_are_argument_arrays": true,
    "fixtures_and_applicability_reviewed": true,
    "upstream_tests_not_requested": true
  },
  "confidence": "high",
  "evidence_notes": "Independent second-pass agreement with the frozen interface, fixture, and source-scope decisions.",
  "adjudication_required": false
}
