{
  "schema_version": 2,
  "project_id": "primer3",
  "source_commit": "4d4c905b7016fd9210948e711413f1c5d15d0b34",
  "review_type": "manifest_curation",
  "reviewer_id": "codex:protocol-review",
  "review_round": 2,
  "sampling_seed": 0,
  "sample": [
    {
      "file": "README.md",
      "start_line": 1,
      "end_line": 120,
      "item_type": "interface_and_source_scope",
      "item_name": "primer3"
    }
  ],
  "assessment": {
    "manifest_sha256": "82f2c51a2a8e2a2fd6a0a61fb8363351655b0605e4e9db868bb1256f771f5b08",
    "source_roots_reviewed": true,
    "commands_are_argument_arrays": true,
    "fixtures_and_applicability_reviewed": true,
    "upstream_tests_not_requested": true
  },
  "confidence": "high",
  "evidence_notes": "Independent second-pass agreement with the frozen interface, fixture, and source-scope decisions.",
  "adjudication_required": false
}
