{
  "schema_version": 2,
  "project_id": "gatk4",
  "source_commit": "f0941754d12d5ed3e91eba449753fb0ad3b54bba",
  "review_type": "manifest_curation",
  "reviewer_id": "codex:protocol-review",
  "review_round": 2,
  "sampling_seed": 0,
  "sample": [
    {
      "file": "README.md",
      "start_line": 115,
      "end_line": 225,
      "item_type": "interface_and_source_scope",
      "item_name": "gatk4"
    }
  ],
  "assessment": {
    "manifest_sha256": "1dd6a6f2d55a21d25debc601bedca0523db3b0957dbcc62c75495ff33a2129e0",
    "source_roots_reviewed": true,
    "commands_are_argument_arrays": true,
    "fixtures_and_applicability_reviewed": true,
    "upstream_tests_not_requested": true
  },
  "confidence": "high",
  "evidence_notes": "Independent second-pass agreement with the frozen interface, fixture, and source-scope decisions.",
  "adjudication_required": false
}
