{
  "schema_version": 2,
  "project_id": "itsxpress",
  "source_commit": "ff381caaba42801500e7bdc8e242ba55efb94898",
  "review_type": "manifest_curation",
  "reviewer_id": "codex:protocol-review",
  "review_round": 2,
  "sampling_seed": 0,
  "sample": [
    {
      "file": "pyproject.toml",
      "start_line": 42,
      "end_line": 43,
      "item_type": "interface_and_source_scope",
      "item_name": "itsxpress"
    }
  ],
  "assessment": {
    "manifest_sha256": "7a19ec0c4ae85609bde229e5b39b824aff53007fe4ebe4770b39dd6a500f7f9a",
    "source_roots_reviewed": true,
    "commands_are_argument_arrays": true,
    "fixtures_and_applicability_reviewed": true,
    "upstream_tests_not_requested": true
  },
  "confidence": "high",
  "evidence_notes": "Independent second-pass agreement with the frozen interface, fixture, and source-scope decisions.",
  "adjudication_required": false
}
