{
  "schema_version": 2,
  "project_id": "portcullis",
  "source_commit": "3adf757e3f90ef4a931025906fa82d7aabd53fba",
  "review_type": "manifest_curation",
  "reviewer_id": "codex:curator",
  "review_round": 1,
  "sampling_seed": 0,
  "sample": [
    {
      "file": "README.md",
      "start_line": 1,
      "end_line": 140,
      "item_type": "interface_and_source_scope",
      "item_name": "portcullis"
    }
  ],
  "assessment": {
    "manifest_sha256": "4235f58d4c5f857cc0f3a6b2950c5efda281eebae4353428fe74552056d31bf0",
    "source_roots_reviewed": true,
    "commands_are_argument_arrays": true,
    "fixtures_and_applicability_reviewed": true,
    "upstream_tests_not_requested": true
  },
  "confidence": "high",
  "evidence_notes": "Initial metadata and upstream-documentation curation of interface, fixtures, and source scope.",
  "adjudication_required": false
}
