{
  "schema_version": 2,
  "project_id": "sra-tools",
  "source_commit": "434ae787c86e32e7faa5e80417a342c365fa03b0",
  "review_type": "manifest_curation",
  "reviewer_id": "codex:protocol-review",
  "review_round": 2,
  "sampling_seed": 0,
  "sample": [
    {
      "file": "README.md",
      "start_line": 1,
      "end_line": 120,
      "item_type": "interface_and_source_scope",
      "item_name": "sra-tools"
    }
  ],
  "assessment": {
    "manifest_sha256": "c8605f2a4e453a565aec80fb6a8427f5721b1fdb5a937be226bd19f17dc8dd64",
    "source_roots_reviewed": true,
    "commands_are_argument_arrays": true,
    "fixtures_and_applicability_reviewed": true,
    "upstream_tests_not_requested": true
  },
  "confidence": "high",
  "evidence_notes": "Independent second-pass agreement with the frozen interface, fixture, and source-scope decisions.",
  "adjudication_required": false
}
