{
  "schema_version": 2,
  "project_id": "yacrd",
  "source_commit": "36f69046e13d807d13ab9ccecec2b52dc770b485",
  "review_type": "manifest_curation",
  "reviewer_id": "codex:protocol-review",
  "review_round": 2,
  "sampling_seed": 0,
  "sample": [
    {
      "file": "src/cli.rs",
      "start_line": 35,
      "end_line": 90,
      "item_type": "interface_and_source_scope",
      "item_name": "yacrd"
    }
  ],
  "assessment": {
    "manifest_sha256": "f5c40e5095e7befc490e0f78462313298b8d87c93d48c050f10f04f25352b512",
    "source_roots_reviewed": true,
    "commands_are_argument_arrays": true,
    "fixtures_and_applicability_reviewed": true,
    "upstream_tests_not_requested": true
  },
  "confidence": "high",
  "evidence_notes": "Independent second-pass agreement with the frozen interface, fixture, and source-scope decisions.",
  "adjudication_required": false
}
