{
  "schema_version": 2,
  "project_id": "ngmlr",
  "source_commit": "a2a31fb6a63547be29c5868a7747e0c6f6e9e41f",
  "review_type": "manifest_curation",
  "reviewer_id": "codex:protocol-review",
  "review_round": 2,
  "sampling_seed": 0,
  "sample": [
    {
      "file": "README.md",
      "start_line": 1,
      "end_line": 140,
      "item_type": "interface_and_source_scope",
      "item_name": "ngmlr"
    }
  ],
  "assessment": {
    "manifest_sha256": "929c408cfc4a7b5638af41fa781634c40272f7956c64f640d34ae2b824c78e2d",
    "source_roots_reviewed": true,
    "commands_are_argument_arrays": true,
    "fixtures_and_applicability_reviewed": true,
    "upstream_tests_not_requested": true
  },
  "confidence": "high",
  "evidence_notes": "Independent second-pass agreement with the frozen interface, fixture, and source-scope decisions.",
  "adjudication_required": false
}
