{
  "schema_version": 2,
  "project_id": "scanpy-scripts",
  "source_commit": "ddc08def1719d5bac2f406239c98184be574930f",
  "review_type": "manifest_curation",
  "reviewer_id": "codex:curator",
  "review_round": 1,
  "sampling_seed": 0,
  "sample": [
    {
      "file": "setup.py",
      "start_line": 19,
      "end_line": 40,
      "item_type": "interface_and_source_scope",
      "item_name": "scanpy-scripts"
    }
  ],
  "assessment": {
    "manifest_sha256": "987b798f2052074a2ea5c187ab8e200f24298124b19c5501efd24882b45359da",
    "source_roots_reviewed": true,
    "commands_are_argument_arrays": true,
    "fixtures_and_applicability_reviewed": true,
    "upstream_tests_not_requested": true
  },
  "confidence": "high",
  "evidence_notes": "Initial metadata and upstream-documentation curation of interface, fixtures, and source scope.",
  "adjudication_required": false
}
