{
  "schema_version": 2,
  "project_id": "pyfaidx",
  "source_commit": "0e824bddd8a5ec306471031fa4bbd7183fe5ed89",
  "review_type": "manifest_curation",
  "reviewer_id": "codex:protocol-review",
  "review_round": 2,
  "sampling_seed": 0,
  "sample": [
    {
      "file": "README.rst",
      "start_line": 378,
      "end_line": 432,
      "item_type": "interface_and_source_scope",
      "item_name": "pyfaidx"
    }
  ],
  "assessment": {
    "manifest_sha256": "a1dfde4c805905855dbcd353db6d73ccb7a19675ce6b5575b97da40062f8d3e5",
    "source_roots_reviewed": true,
    "commands_are_argument_arrays": true,
    "fixtures_and_applicability_reviewed": true,
    "upstream_tests_not_requested": true
  },
  "confidence": "high",
  "evidence_notes": "Independent second-pass agreement with the frozen interface, fixture, and source-scope decisions.",
  "adjudication_required": false
}
