{
  "schema_version": 2,
  "project_id": "fastp",
  "source_commit": "23d6211d4f05d61f561899f1b7702435a4b5d408",
  "review_type": "manifest_curation",
  "reviewer_id": "codex:protocol-review",
  "review_round": 2,
  "sampling_seed": 0,
  "sample": [
    {
      "file": "README.md",
      "start_line": 320,
      "end_line": 360,
      "item_type": "interface_and_source_scope",
      "item_name": "fastp"
    }
  ],
  "assessment": {
    "manifest_sha256": "60258a50dcc675a3c10ea8ebb51cbcbb509a701a2a5bad7d749841f99caeb3a4",
    "source_roots_reviewed": true,
    "commands_are_argument_arrays": true,
    "fixtures_and_applicability_reviewed": true,
    "upstream_tests_not_requested": true
  },
  "confidence": "high",
  "evidence_notes": "Independent second-pass agreement with the frozen interface, fixture, and source-scope decisions.",
  "adjudication_required": false
}
