{
  "schema_version": 2,
  "project_id": "muscle",
  "source_commit": "6c69a9b2c73ce2d48128db889bfc0ef195153f2e",
  "review_type": "manifest_curation",
  "reviewer_id": "codex:protocol-review",
  "review_round": 2,
  "sampling_seed": 0,
  "sample": [
    {
      "file": "README.md",
      "start_line": 1,
      "end_line": 120,
      "item_type": "interface_and_source_scope",
      "item_name": "muscle"
    }
  ],
  "assessment": {
    "manifest_sha256": "51bc503caf8ba6937489fdb8bb899d6352b63e428583e1610da3293859a5fdb0",
    "source_roots_reviewed": true,
    "commands_are_argument_arrays": true,
    "fixtures_and_applicability_reviewed": true,
    "upstream_tests_not_requested": true
  },
  "confidence": "high",
  "evidence_notes": "Independent second-pass agreement with the frozen interface, fixture, and source-scope decisions.",
  "adjudication_required": false
}
